{"capabilities":{"diff":false,"regions":false},"captureClaimsTrusted":false,"claims":{},"comparator":{"version":1},"counts":{"added":0,"changed":0,"failed":1,"incomparable":1,"missing":1,"removed":0,"subtle":0,"unchanged":0},"coverage":{"accountedUnits":2,"declaredUnits":3,"missingParts":[],"status":"incomplete"},"parts":[{"artifactId":"1001","providerId":"tiny","revision":"head","shard":{"count":1,"index":1},"status":"valid"}],"results":[{"base":{"state":"none"},"head":{"category":"capture-error","state":"failed"},"providerId":"tiny","reasons":["capture-failed","no-baseline"],"status":"failed","variantId":"desktop","viewId":"failed-over-none"},{"base":{"state":"none"},"head":{"cause":"unit-missing","state":"missing"},"providerId":"tiny","reasons":["unit-missing","no-baseline"],"status":"missing","variantId":"desktop","viewId":"missing-over-none"},{"base":{"state":"none"},"head":{"height":4,"pixelHash":"52ea527c91b0d068217fcbfb288329ba3a7529c3d9acfbfd26654700ddebc4f3","state":"captured","width":4},"images":{"head":"https://owner.github.io/repo/pixelwatch/blobs/52/52ea527c91b0d068217fcbfb288329ba3a7529c3d9acfbfd26654700ddebc4f3.png"},"providerId":"tiny","reasons":["no-baseline"],"status":"incomparable","variantId":"desktop","viewId":"no-baseline"}],"runKey":"10-a1","schemaVersion":1,"source":{"association":"none","attempt":"1","createdAt":"2026-09-20T09:00:00Z","event":"push","headSha":"7777777777777777777777777777777777777777","repositoryId":"987654321","runId":"10","workflowId":"123456"}}